{
  "schema_version": "perseus-vault-handling-profile-corpus/v1",
  "corpus_version": "govcon-synthetic-handling-2026-08-19",
  "policy_version": "govcon-handling-policy/v1",
  "taxonomy_version": "govcon-handling-taxonomy/v1",
  "provider_mode": "zero-model-zero-network",
  "cases": [
    {
      "case_id": "public-safe-basic",
      "workspace": "workspace-a",
      "scope": "project-alpha",
      "input_state": "complete",
      "redaction_mode": "none",
      "redaction_exclude_fields": [],
      "expected_profile": "PUBLIC_SAFE",
      "expected_outcome": "SAVE/AGENT_VISIBLE",
      "candidate": {
        "content": "Public release notes for alpha.",
        "title": "Public release",
        "safe_summary": "A releasable summary.",
        "core_tags": ["release", "public"],
        "project": "alpha",
        "task": "publish-notes",
        "topic": "documentation",
        "source_refs": [{"label": "public-doc", "uri": "synthetic://public-doc"}],
        "contract_id": "PUBLIC-ALPHA",
        "program_id": "PROGRAM-ALPHA",
        "workspace": "workspace-a",
        "scope": "project-alpha"
      }
    },
    {
      "case_id": "public-safe-near-miss",
      "workspace": "workspace-a",
      "scope": "project-alpha",
      "input_state": "complete",
      "redaction_mode": "none",
      "redaction_exclude_fields": [],
      "expected_profile": "PUBLIC_SAFE",
      "expected_outcome": "SAVE/AGENT_VISIBLE",
      "candidate": {
        "content": "A fiction workshop discusses public documentation.",
        "title": "Public writing guide",
        "safe_summary": "No restricted handling signal is present.",
        "core_tags": ["writing", "public"],
        "project": "alpha",
        "task": "draft-guide",
        "topic": "documentation",
        "source_refs": [{"label": "public-guide", "uri": "synthetic://public-guide"}],
        "contract_id": "PUBLIC-ALPHA-GUIDE",
        "program_id": "PROGRAM-ALPHA",
        "workspace": "workspace-a",
        "scope": "project-alpha"
      }
    },
    {
      "case_id": "fci-title-only",
      "workspace": "workspace-a",
      "scope": "project-alpha",
      "input_state": "complete",
      "redaction_mode": "none",
      "redaction_exclude_fields": [],
      "expected_profile": "FCI_LIKE",
      "expected_outcome": "PROTECTED",
      "candidate": {
        "content": "A synthetic project note.",
        "title": "FCI-SYNTHETIC-TITLE",
        "safe_summary": "A non-sensitive summary.",
        "core_tags": ["project"],
        "project": "alpha",
        "task": "review",
        "topic": "planning",
        "source_refs": [{"label": "internal-ref", "uri": "synthetic://fci-title"}],
        "contract_id": "PROGRAM-ALPHA",
        "program_id": "PROGRAM-ALPHA",
        "workspace": "workspace-a",
        "scope": "project-alpha"
      }
    },
    {
      "case_id": "cui-summary-only",
      "workspace": "workspace-a",
      "scope": "project-alpha",
      "input_state": "complete",
      "redaction_mode": "none",
      "redaction_exclude_fields": [],
      "expected_profile": "CUI_LIKE",
      "expected_outcome": "PROTECTED",
      "candidate": {
        "content": "A synthetic handling note.",
        "title": "Program summary",
        "safe_summary": "CUI-SYNTHETIC-SUMMARY",
        "core_tags": ["program"],
        "project": "alpha",
        "task": "review",
        "topic": "planning",
        "source_refs": [{"label": "program-ref", "uri": "synthetic://cui-summary"}],
        "contract_id": "PROGRAM-ALPHA",
        "program_id": "PROGRAM-ALPHA",
        "workspace": "workspace-a",
        "scope": "project-alpha"
      }
    },
    {
      "case_id": "cui-redactable-content",
      "workspace": "workspace-a",
      "scope": "project-alpha",
      "input_state": "complete",
      "redaction_mode": "permitted",
      "redaction_exclude_fields": [],
      "expected_profile": "CUI_LIKE",
      "expected_outcome": "SAVE/AGENT_VISIBLE",
      "candidate": {
        "content": "CUI-SYNTHETIC-REDACT-ME",
        "title": "Safe projection candidate",
        "safe_summary": "The sensitive marker is synthetic.",
        "core_tags": ["program"],
        "project": "alpha",
        "task": "summarize",
        "topic": "planning",
        "source_refs": [{"label": "synthetic-ref", "uri": "synthetic://case-5"}],
        "contract_id": "PROGRAM-ALPHA",
        "program_id": "PROGRAM-ALPHA",
        "workspace": "workspace-a",
        "scope": "project-alpha"
      }
    },
    {
      "case_id": "export-project-only",
      "workspace": "workspace-b",
      "scope": "project-alpha",
      "input_state": "complete",
      "redaction_mode": "none",
      "redaction_exclude_fields": [],
      "expected_profile": "EXPORT_CONTROLLED_SIGNAL",
      "expected_outcome": "PROTECTED",
      "candidate": {
        "content": "A synthetic project record.",
        "title": "Project record",
        "safe_summary": "A bounded summary.",
        "core_tags": ["project"],
        "project": "EXPORT-CONTROLLED-SYNTHETIC-PROJECT",
        "task": "review",
        "topic": "planning",
        "source_refs": [{"label": "export-ref", "uri": "synthetic://export-project"}],
        "contract_id": "PROGRAM-BETA",
        "program_id": "PROGRAM-BETA",
        "workspace": "workspace-b",
        "scope": "project-alpha"
      }
    },
    {
      "case_id": "credential-tag-only",
      "workspace": "workspace-a",
      "scope": "project-alpha",
      "input_state": "complete",
      "redaction_mode": "none",
      "redaction_exclude_fields": [],
      "expected_profile": "CREDENTIAL",
      "expected_outcome": "BLOCK",
      "candidate": {
        "content": "A synthetic deployment note.",
        "title": "Deployment note",
        "safe_summary": "No secret value is present.",
        "core_tags": ["release", "API_KEY-SYNTHETIC"],
        "project": "alpha",
        "task": "deploy",
        "topic": "operations",
        "source_refs": [{"label": "ops-ref", "uri": "synthetic://credential-tag"}],
        "contract_id": "PROGRAM-ALPHA",
        "program_id": "PROGRAM-ALPHA",
        "workspace": "workspace-a",
        "scope": "project-alpha"
      }
    },
    {
      "case_id": "internal-topic-only",
      "workspace": "workspace-a",
      "scope": "project-alpha",
      "input_state": "complete",
      "redaction_mode": "none",
      "redaction_exclude_fields": [],
      "expected_profile": "INTERNAL_PROGRAM",
      "expected_outcome": "PROTECTED",
      "candidate": {
        "content": "A synthetic coordination note.",
        "title": "Team planning",
        "safe_summary": "Internal planning context.",
        "core_tags": ["planning"],
        "project": "alpha",
        "task": "coordinate",
        "topic": "INTERNAL-PROGRAM-SYNTHETIC-TOPIC",
        "source_refs": [{"label": "team-ref", "uri": "synthetic://internal-topic"}],
        "contract_id": "PROGRAM-ALPHA",
        "program_id": "PROGRAM-ALPHA",
        "workspace": "workspace-a",
        "scope": "project-alpha"
      }
    },
    {
      "case_id": "review-ambiguous-source",
      "workspace": "workspace-a",
      "scope": "project-alpha",
      "input_state": "ambiguous",
      "redaction_mode": "none",
      "redaction_exclude_fields": [],
      "expected_profile": "REVIEW_REQUIRED",
      "expected_outcome": "PENDING_REVIEW",
      "candidate": {
        "content": "A synthetic note requiring policy review.",
        "title": "Ambiguous note",
        "safe_summary": "The handling state is not established.",
        "core_tags": ["review"],
        "project": "alpha",
        "task": "triage",
        "topic": "review",
        "source_refs": [{"label": "AMBIGUOUS-SIGNAL", "uri": "synthetic://ambiguous"}],
        "contract_id": "PROGRAM-ALPHA",
        "program_id": "PROGRAM-ALPHA",
        "workspace": "workspace-a",
        "scope": "project-alpha"
      }
    },
    {
      "case_id": "provider-unavailable",
      "workspace": "workspace-a",
      "scope": "project-alpha",
      "input_state": "provider-unavailable",
      "redaction_mode": "none",
      "redaction_exclude_fields": [],
      "expected_profile": "REVIEW_REQUIRED",
      "expected_outcome": "REVIEW_REQUIRED",
      "candidate": {
        "content": "A synthetic candidate with no provider dependency.",
        "title": "Provider unavailable case",
        "safe_summary": "The default lane must remain explicit.",
        "core_tags": ["review"],
        "project": "alpha",
        "task": "triage",
        "topic": "review",
        "source_refs": [{"label": "provider-state", "uri": "synthetic://provider-unavailable"}],
        "contract_id": "PROGRAM-ALPHA",
        "program_id": "PROGRAM-ALPHA",
        "workspace": "workspace-a",
        "scope": "project-alpha"
      }
    },
    {
      "case_id": "malformed-metadata",
      "workspace": "workspace-a",
      "scope": "project-alpha",
      "input_state": "malformed",
      "redaction_mode": "none",
      "redaction_exclude_fields": [],
      "expected_profile": "REVIEW_REQUIRED",
      "expected_outcome": "REVIEW_REQUIRED",
      "candidate": {
        "content": "A malformed synthetic candidate.",
        "title": "Missing topic field",
        "safe_summary": "Required metadata is intentionally absent.",
        "core_tags": ["review"],
        "project": "alpha",
        "task": "triage",
        "source_refs": [{"label": "malformed", "uri": "synthetic://malformed"}],
        "contract_id": "PROGRAM-ALPHA",
        "program_id": "PROGRAM-ALPHA",
        "workspace": "workspace-a",
        "scope": "project-alpha"
      }
    },
    {
      "case_id": "incomplete-redaction",
      "workspace": "workspace-a",
      "scope": "project-alpha",
      "input_state": "complete",
      "redaction_mode": "incomplete",
      "redaction_exclude_fields": ["source_refs"],
      "expected_profile": "CUI_LIKE",
      "expected_outcome": "REVIEW_REQUIRED",
      "candidate": {